{
  "name": "Wemos D1 R32",
  "processor": "esp32",
  "match": [],
  "wifi": true,
  "pins": {
    "D0": 3, "D1": 1, "D2": 26, "D3": 25, "D4": 17, "D5": 16, "D6": 27, "D7": 14,
    "D8": 12, "D9": 13, "D10": 5, "D11": 23, "D12": 19, "D13": 18,
    "A0": 2, "A1": 4, "A2": 35, "A3": 34, "A4": 36, "A5": 39,
    "SDA": 21, "SCL": 22
  },
  "free": ["16-17"],
  "avoid": {
    "2": "Strapping pin, and the onboard LED. Must be low or floating at reset to flash the board.",
    "5": "Strapping pin. Sets flash timing at reset.",
    "12": "Strapping pin. High at reset selects 1.8 V flash and the board won't boot, so a shield mustn't pull it high."
  },
  "notes": "Arduino Uno layout with an ESP32-WROOM-32. Pins are labelled by their Arduino names: D0 and D1 are the USB serial link. A2-A5 (GPIO 35, 34, 36, 39) are input only, so a shield that drives them, such as an MCUFRIEND parallel TFT, needs wires to spare GPIOs (usually 15, 33 and 32). The onboard LED is on A0 (GPIO 2). The silkscreen on some boards mislabels A2 and A4. Pick this board by hand: MicroPython reports a generic ESP32.",
  "firmware": {
    "tool": "esptool",
    "transport": "serial",
    "image": {
      "url": "https://micropython.org/resources/firmware/ESP32_GENERIC-20260824-v1.29.0.bin",
      "sha256": "e67ad6015a0a504c1fec9aa9bbf589d0432ed28e62546f4f8dd8a147f8bd95f6"
    },
    "runtime": "install",
    "flash": { "chip": "esp32", "baud": 460800, "offset": 4096 }
  }
}
